{
  "$schema": "./fork-manifest.schema.json",
  "description": "Inventory of retained fork-only core patches. fork-drift-check.py evaluates each probe against upstream/main so absorbed features can be removed. Standalone extensions live in DysektAI/pi-extensions.",
  "identity": {
    "name": "DysektAI",
    "email": "33468668+DysektAI@users.noreply.github.com"
  },
  "upstreamRef": "upstream/main",
  "integrationBranch": "local",
  "notes": [
    "Scope: retained fork-only patches on local, plus branches deliberately NOT merged. Standalone extensions keep development branches in this repo but ship from DysektAI/pi-extensions (see the notes below); listing them as features would falsely imply local carries their code.",
    "Standalone extensions and read-outline behavior ship from DysektAI/pi-extensions. Their development branches are not merged into local or included in this core patch inventory.",
    "Absorbed upstream, no entry needed: feat/max-thinking-level. refactor/deduplicate-shared-utils was only partly absorbed; its remaining delta is listed as a feature.",
    "Retired by user preference: feat/model-selector-provider-first and feat/user-bash-header. The model selector and user-invoked Bash display now use upstream rendering. Agent tool headers remain in DysektAI/pi-extensions.",
    "Moved to DysektAI/pi-extensions (v0.5.0) and removed from local: [Thinking] label (thinking-label), [X Tool] call headers + path colour + VS Code paths (tool-headers), inline-code path links (path-links), Synthetic provider (synthetic), compaction.maxContextTokens (context-management). Dropped without replacement: toolPath theme token and missing-token warning, pi.getExtensions() (startup-welcome uses tool/command sourceInfo), stripGhostTokens (never called)."
  ],
  "features": [
    {
      "branch": "fix/pre-commit-staged-deletions",
      "summary": "Pre-commit restaging preserves deliberate staged deletions and literal filenames, including whitespace, without staging unrelated formatter changes.",
      "base": "local",
      "mergeIntoLocal": true,
      "drift": {
        "type": "grep-absent",
        "ref": "upstream/main",
        "file": ".husky/pre-commit",
        "pattern": "--diff-filter=d",
        "note": "Re-check deletion handling and NUL-delimited literal restaging if upstream excludes staged deletions."
      }
    },
    {
      "branch": "fork-maintenance",
      "summary": "Merge-based upstream sync, drift inventory, the tracked consumer job (.fork/local-sync.sh + .fork/systemd units), and docs. Feature names identify patches, not branches that must remain live.",
      "base": "main",
      "mergeIntoLocal": true,
      "drift": {
        "type": "path-absent",
        "ref": "upstream/main",
        "path": "fork-sync.sh",
        "note": "Tooling is inherently fork-only; upstream will never carry it. Probe stays ACTIVE."
      }
    },
    {
      "branch": "feat/markdown-codeblock-border-style",
      "summary": "Configurable code block border styles in the TUI markdown renderer.",
      "base": "main",
      "mergeIntoLocal": true,
      "drift": {
        "type": "grep-absent",
        "ref": "upstream/main",
        "file": "packages/coding-agent/src/core/settings-manager.ts",
        "pattern": "odeBlockBorderStyle"
      }
    },
    {
      "branch": "feat/test-bounded-pool",
      "summary": "Bounds vitest worker concurrency to prevent host overload.",
      "base": "main",
      "mergeIntoLocal": true,
      "drift": {
        "type": "path-present",
        "ref": "upstream/main",
        "path": "scripts/vitest-pool.mjs",
        "note": "REDUNDANT if upstream ships its own worker-cap script at this path."
      }
    },
    {
      "branch": "fix/improve-error-handling",
      "summary": "Surface errors via stderr (avoid TUI corruption), add stack traces, preserve OAuth error cause.",
      "base": "main",
      "mergeIntoLocal": true,
      "drift": {
        "type": "grep-absent",
        "ref": "upstream/main",
        "file": "packages/coding-agent/src/core/event-bus.ts",
        "pattern": "onError"
      }
    },
    {
      "branch": "test/add-unit-tests-coverage",
      "summary": "Unit tests for previously untested pure-logic modules across all packages.",
      "base": "main",
      "mergeIntoLocal": true,
      "drift": {
        "type": "grep-present",
        "ref": "upstream/main",
        "file": "packages/coding-agent/test/changelog.test.ts",
        "pattern": "parseChangelog",
        "note": "Supplemental changelog, AI utility, MIME, and TUI editor tests remain downstream. Tests for the removed experimental agent harness were dropped during the 1.0.0 sync. This probe flags absorbed parseChangelog coverage; re-verify the other suites before dropping."
      }
    },
    {
      "branch": "fix/openai-auth-error",
      "summary": "OpenAI-compatible streams surface a clear authentication-failure message naming the provider on HTTP 401/403, instead of an opaque status-code error.",
      "base": "main",
      "mergeIntoLocal": true,
      "drift": {
        "type": "grep-absent",
        "ref": "upstream/main",
        "file": "packages/ai/src/api/openai-completions.ts",
        "pattern": "formatErrorMessage",
        "note": "REDUNDANT if upstream adds its own auth-failure messaging for 401/403 in openai-completions."
      }
    },
    {
      "branch": "fix/opencode-zen-free-tier",
      "summary": "OpenCode Zen/Go requests carry an opencode/<version> User-Agent, an OpenCode-shaped ses_ session header, and inert bash/read tool declarations so the free-tier gate accepts Pi (all request paths, including compaction and compat complete()). Kept in core: an extension cannot preserve builtin routing for other providers, credential-pool key rotation, and models.json custom models at once.",
      "base": "local",
      "mergeIntoLocal": true,
      "drift": {
        "type": "grep-absent",
        "ref": "upstream/main",
        "file": "packages/ai/src/providers/opencode-headers.ts",
        "pattern": "formatOpenCodeSessionId",
        "note": "REDUNDANT if upstream sends OpenCode client identity and session headers itself."
      }
    },
    {
      "branch": "feat/fork-release-channel",
      "summary": "Verified fork source checkouts follow DysektAI/pi-fork GitHub releases for version checks, and `pi update --self` fast-forwards the checkout to origin/local and rebuilds (config.ts, version-check.ts, package-manager-cli.ts, release changelog URL). See FORK.md 'Releases and self-update'.",
      "base": "local",
      "mergeIntoLocal": true,
      "drift": {
        "type": "grep-absent",
        "ref": "upstream/main",
        "file": "packages/coding-agent/src/utils/version-check.ts",
        "pattern": "DysektAI/pi-fork",
        "note": "Inherently fork-only; stays ACTIVE."
      }
    },
    {
      "branch": "fix/remote-catalog-native-refresh",
      "summary": "withRemoteCatalog leaves providers that implement refreshModels unwrapped so their own refresh/persistence runs and an empty pi.dev overlay cannot overwrite their cached catalog.",
      "base": "local",
      "mergeIntoLocal": true,
      "drift": {
        "type": "grep-absent",
        "ref": "upstream/main",
        "file": "packages/coding-agent/src/core/remote-catalog-provider.ts",
        "pattern": "refreshModels\\) return provider",
        "note": "REDUNDANT if upstream skips wrapping native dynamic providers."
      }
    },
    {
      "branch": "fix/model-scope-exact-glob",
      "summary": "Model scope patterns containing glob characters first try an exact model reference, and invalid thinking-level suffixes produce a diagnostic instead of breaking the match.",
      "base": "local",
      "mergeIntoLocal": true,
      "drift": {
        "type": "grep-absent",
        "ref": "upstream/main",
        "file": "packages/coding-agent/src/core/model-resolver.ts",
        "pattern": "fullExactMatch",
        "note": "REDUNDANT if upstream resolves exact references before glob expansion."
      }
    },
    {
      "branch": "refactor/deduplicate-shared-utils",
      "summary": "coding-agent truncateTail preserves byte-truncation classification; read tools shell-quote the absolute path in the over-long-line bash hint. The removed experimental agent harness no longer supplies shared truncation exports.",
      "base": "local",
      "mergeIntoLocal": true,
      "drift": {
        "type": "grep-absent",
        "ref": "upstream/main",
        "file": "packages/coding-agent/src/core/tools/truncate.ts",
        "pattern": "truncatedBy !== \"bytes\"",
        "note": "REDUNDANT if upstream preserves byte classification when the byte and line limits both apply. Re-check the read-tool quotedPath hint separately before dropping."
      }
    },
    {
      "branch": "fix/pr-review-hardening",
      "summary": "Review follow-ups kept in core: Vertex accepts Google Cloud metadata credentials without an ADC file, the external editor passes the prompt path through an env var under a shell, and aborted compaction summaries throw AbortError.",
      "base": "local",
      "mergeIntoLocal": true,
      "drift": {
        "type": "grep-absent",
        "ref": "upstream/main",
        "file": "packages/ai/src/providers/google-vertex.ts",
        "pattern": "Google Cloud metadata credentials",
        "note": "REDUNDANT if upstream supports Vertex metadata-server credentials; re-check external-editor.ts and compaction.ts separately."
      }
    },
    {
      "branch": "fix/mcp-oauth-credentials",
      "summary": "Remove both named and legacy OAuth credentials on sign-out. The former issuer check without server metadata was dropped in favor of upstream c5f5b3282, which rejects any iss when no metadata was discovered.",
      "base": "local",
      "mergeIntoLocal": true,
      "drift": {
        "type": "grep-absent",
        "ref": "upstream/main",